<?xml version="1.0" encoding="UTF-8" ?>
<ns:root xmlns:ns="edu.upc.dmag" xmlns:xsi="http://www.w3.org/2001/XMLSchema-instance"
         xsi:schemaLocation="edu.upc.dmag TestingSequence.xsd">
    <ns:entry>
        <ns:sequenceEntry>
            <ns:element_a>test_a1</ns:element_a>
        </ns:sequenceEntry>
        <ns:sequenceEntry>
            <ns:element_a>test_b1</ns:element_a>
        </ns:sequenceEntry>
    </ns:entry>

    <ns:entry>
        <ns:sequenceEntry>
            <ns:element_a>test_a2</ns:element_a>
        </ns:sequenceEntry>
        <ns:sequenceEntry>
            <ns:element_a>test_b1</ns:element_a>
        </ns:sequenceEntry>
    </ns:entry>
</ns:root>